<xsd:schema xmlns:xsd="http://www.w3.org/2001/XMLSchema" xmlns:vc="http://www.w3.org/2007/XMLSchema-versioning" vc:minVersion="1.1">
	<xsd:element name="products">
		<xsd:complexType>
			<xsd:sequence>
				<xsd:element ref="product" maxOccurs="unbounded"/>
			</xsd:sequence>
		</xsd:complexType>
	</xsd:element>
	<xsd:element name="product" type="productType"/>
	<xsd:complexType name="productType">
		<xsd:sequence>
			<xsd:element name="id" type="xsd:string"/>
			<xsd:element name="color" type="xsd:string"/>
			<xsd:element name="size" type="xsd:string"/>			
		</xsd:sequence>
	</xsd:complexType>
</xsd:schema>
